Id,Question,Type,Image,Option 1,Image 1,Option 2,Image 2,Option 3,Image 3,Option 4,Image 4,Option 5,Image 5,Option 6,Image 6,Option 7,Image 7,Option 8,Image 8,Option 9,Image 9,Option 10,Image 10,Option 11,Image 11,Option 12,Image 12,Option 13,Image 13,Option 14,Image 14,Option 15,Image 15,Correct Answer
1,"In volleyball, a member of Team A hits the ball so hard it hits the ceiling, and it comes back down on Team A's side. Then, another member of Team A sets the ball over to Team B, but Team B misses. Who gets the point?",MC,,Team A,,Team B,,Neither,,Whoever's more intimidating,,,,,,,,,,,,,,,,,,,,,,,,1
2,Which of the following are necessary when playing floor hockey?,MC,,Hairties,,Safety goggles,,Mouthguards,,Earplugs,,,,,,,,,,,,,,,,,,,,,,,,2
3,Is teamwork important in project adventure?,MC,,Yes,,No,,Rarely,,It depends on the situation,,,,,,,,,,,,,,,,,,,,,,,,1
4,The Cheshire High School demonstration during the 2019 Health and Wellness fair was...,MC,,Parachute,,Karate,,Line Dancing,,Baking,,,,,,,,,,,,,,,,,,,,,,,,3
5,Physical education class meets ____ every eight days.,MC,,Once,,Twice,,Thrice,,Four Times,,,,,,,,,,,,,,,,,,,,,,,,2
