Id,Question,Type,Image,Option 1,Image 1,Option 2,Image 2,Option 3,Image 3,Option 4,Image 4,Option 5,Image 5,Option 6,Image 6,Option 7,Image 7,Option 8,Image 8,Option 9,Image 9,Option 10,Image 10,Option 11,Image 11,Option 12,Image 12,Option 13,Image 13,Option 14,Image 14,Option 15,Image 15,Correct Answer
1,Distracted driving is very similar to...,MC,,Driving with a blindfold,,Driving with loud music,,Driving through a garbage can,,Driving while chewing gum,,,,,,,,,,,,,,,,,,,,,,,,1
2,What is the curfew for 16 and 17 year olds when it comes to driving with a license?,MC,,11:00pm-12:00am,,11:00pm-5:00am,,12:00am-4:00am,,2:00am-5:00am,,,,,,,,,,,,,,,,,,,,,,,,2
3,"When multiple people require aid, in what order should you give care?",MC,,Least severe condition to most severe condition,,Most severe condition to least severe condition,,Person you like most to person you like least,,Tallest to Shortest,,,,,,,,,,,,,,,,,,,,,,,,2
4,Giving CPR involves 30 chest compressions and 2...,MC,,Forehead slaps,,"Playings of the song ""Staying Alive""",,Rescue Breaths,,Attempts to call 9-1-1,,,,,,,,,,,,,,,,,,,,,,,,3
5,All of the following are forms of contraception EXCEPT...,MC,,The pill,,Male Condom,,The patch,,Coughdrops,,,,,,,,,,,,,,,,,,,,,,,,4
