Id,Question,Type,Image,Option 1,Image 1,Option 2,Image 2,Option 3,Image 3,Option 4,Image 4,Option 5,Image 5,Option 6,Image 6,Option 7,Image 7,Option 8,Image 8,Option 9,Image 9,Option 10,Image 10,Option 11,Image 11,Option 12,Image 12,Option 13,Image 13,Option 14,Image 14,Option 15,Image 15,Correct Answer
1,Which of the following describes proper marching technique?,MC,,"Lifting up your foot, then plopping it back down",,Pushing off the platform of the stationary foot,,Jumping and landing,,Falling Down,,,,,,,,,,,,,,,,,,,,,,,,2
2,"From the audience's point of view, side 1 is ______ side 2.",MC,,In front of,,Behind,,Left of,,Right of,,,,,,,,,,,,,,,,,,,,,,,,3
3,Center X is...,MC,,On the 50 yd line,,On the front hash,,On the back hash,,Two of the above,,,,,,,,,,,,,,,,,,,,,,,,1
4,"How many counts are there in the entirety of the ""You've Changed"" show?",MC,,429,,856,,1361,,2945,,,,,,,,,,,,,,,,,,,,,,,,3
5,Which of the following was not incorporated in the 2019 CHSMRB show?,MC,,Mahler,,Jar of Hearts,,Changes,,You've Changed,,,,,,,,,,,,,,,,,,,,,,,,2
