Id,Question,Type,Image,Option 1,Image 1,Option 2,Image 2,Option 3,Image 3,Option 4,Image 4,Option 5,Image 5,Option 6,Image 6,Option 7,Image 7,Option 8,Image 8,Option 9,Image 9,Option 10,Image 10,Option 11,Image 11,Option 12,Image 12,Option 13,Image 13,Option 14,Image 14,Option 15,Image 15,Correct Answer
1,Note accuracy is...,MC,,How fast notes are played,,The style of notes,,How correctly notes are played,,Note lengths,,,,,,,,,,,,,,,,,,,,,,,,3
2,What is the enharmonic of A#?,MC,,G#,,Ab,,Bb,,B,,,,,,,,,,,,,,,,,,,,,,,,3
3,"In the 2017-2018 school year, what is the report time before a concert for Wind Ensemble?",MC,,5:45pm,,6:15pm,,6:45pm,,8:30am,,,,,,,,,,,,,,,,,,,,,,,,2
4,What is NOT a common nickname for Mr. Kuhner?,MC,,K-Dog,,Papa John,,J Lennie,,K Money,,,,,,,,,,,,,,,,,,,,,,,,3
5,What is the fourth note of the Ab major scale?,MC,,Ab,,Bb,,Db,,Eb,,,,,,,,,,,,,,,,,,,,,,,,3
